{
  "metadata": {
    "timestamp": "2025-12-17T12:00:00Z",
    "version": "2.0.0",
    "scenario": "Economically Viable"
  },
  "parameters": {
    "shared": { "years": 5, "targetGW": 1 },
    "launchCostTrajectory": { "launchCost2025": 1500, "launchCost2030": 500, "launchCost2035": 200, "launchCost2040": 100, "launchLearningRate": 0.15, "launchCadence2030": 500 },
    "specificPowerTrajectory": { "specificPower2025": 50, "specificPower2030": 100, "specificPower2035": 125, "specificPower2040": 150, "computeDensityKW": 50, "satelliteLifetimeYears": 6 },
    "computeEfficiencyTrajectory": { "flopsPerWattGround2025": 30, "flopsPerWattGround2040": 60, "flopsPerWattOrbital2025": 30, "flopsPerWattOrbital2040": 90, "hardwareLearningRate": 0.1 },
    "groundConstraints": { "pueGround": 1.3, "groundEnergyEscalationRate": 0.02, "powerGridMultiplier": 1.05, "coolingMultiplier": 1.03, "interconnectionDelayYears": 4, "groundLearningRate": 0.03, "waterScarcityEnabled": true, "landScarcityEnabled": true },
    "spaceConstraints": { "pueOrbital": 1.05, "capacityFactorOrbital": 0.98, "orbitalAltitude": 550, "eccOverhead": 0.15, "radiatorAreaPerKW": 3.5, "laserLinkCost": 10, "groundStationCount": 100 },
    "economics": { "discountRateWACC": 0.07, "gasPricePerMMBtu": 4.3, "carbonPricePerTon": 0, "opexOrbital": 0.01, "opexGround": 0.03, "groundHeatRateBTUperKWh": 6200 },
    "toggles": { "pueAdvantageEnabled": true, "uptimeAdvantageEnabled": true, "computeTrajectoryEnabled": true, "groundConstraintsEnabled": true, "launchDeclineEnabled": true, "radiationOverheadEnabled": true, "thermalMassEnabled": true },
    "mechanics": { "sunFraction": 0.98, "cellDegradation": 2.5, "gpuFailureRate": 9, "nreCost": 1000 }
  },
  "pflopBenchmarks": {
    "2025": { "ground": 450000, "orbital": 1200000 },
    "2032": { "ground": 480000, "orbital": 420000 },
    "2040": { "ground": 520000, "orbital": 280000 }
  },
  "validations": {
    "agreement2025": {
        "passed": true,
      "value": "3.77%",
      "threshold": "5.00%",
      "myana2025LCOE": 1211,
      "mccalip2025LCOE": 1167
      },
    "thermalFeasibility": {
        "passed": true,
      "value": "175.0 m²/sat",
      "threshold": "100 m²/sat"
      },
    "crossoverDetected": {
        "passed": true,
      "value": 2032
    }
  },
  "sensitivityRankings": [
    { "parameter": "Launch Cost 2040", "impact": "High", "value": 100 },
    { "parameter": "Orbital Compute Efficiency 2040", "impact": "High", "value": 90 },
    { "parameter": "Ground Grid Bottleneck", "impact": "Medium", "value": 1.05 },
    { "parameter": "Satellite Specific Power 2040", "impact": "Medium", "value": 150 },
    { "parameter": "Orbital PUE", "impact": "Low", "value": 1.05 }
  ],
  "computeEconomicsTrajectory": [
    {
      "year": 2025,
      "groundPFLOPCost": 450000,
      "orbitalPFLOPCost": 1200000,
      "isOrbitalCheaper": false,
      "orbitalLCOE": 1211,
      "mccalipLCOE": 1167,
      "launchCostKg": 1500,
      "specificPowerWKg": 50
  }
  ]
}
